{
  "accepted": false,
  "artifact_path": "/Users/gunnchos/Downloads/gunnchos-7gc-research-product-spine/repos/archive-of-life-artifact-world",
  "artifact_sha256": "74907e879a222dcbb272b05ae46ee9b19568a382ca68c63b8ca1d2cbef87e0c6",
  "claim_level": "SOFTWARE_SLICE",
  "collected_at_utc": "2026-08-06T20:16:46Z",
  "evidence_class": "software",
  "evidence_id": "game-archive-of-life-artifact-world-gate1-run-2026-08-06T201646Z",
  "notes": "{\"build_id\": \"gate1-software-discovery\", \"commit\": \"46ba34187ce5\", \"detail\": {\"evidence_class\": \"software\", \"markers\": [\"README.md\", \"package.json\"], \"notes\": \"software discovery; not physical device core loop\"}, \"evidence_type\": \"runtime_smoke\", \"game\": \"archive-of-life-artifact-world\", \"platform\": \"software_harness\", \"result\": \"pass\", \"session_id\": \"gate1-soft-archive-of-life-artifact-world\", \"state_checksum\": \"a143fe6ada22e689\", \"step\": \"discover_repo_and_markers\", \"timestamp\": \"2026-08-06T20:16:46+00:00\"}",
  "schema_version": "1.0.0",
  "tool_versions": {
    "gate1_orchestrator": "0.1.0",
    "platform": "macOS-26.5.2-arm64-arm-64bit",
    "python": "3.11.2"
  },
  "workstream": "games"
}
