{
  "schema_version": "1.0.0",
  "evidence_id": "ev-soft-1",
  "workstream": "boot",
  "evidence_class": "software",
  "artifact_path": "gate1/evidence/pending/example.json",
  "artifact_sha256": "bbbbbbbbbbbbbbbbbbbbbbbbbbbbbbbbbbbbbbbbbbbbbbbbbbbbbbbbbbbbbbbb",
  "tool_versions": {
    "python": "3.12.0",
    "gate1_orchestrator": "0.1.0"
  },
  "collected_at_utc": "2026-08-06T12:00:00Z",
  "claim_level": "SOFTWARE_SLICE",
  "accepted": false,
  "notes": "valid software evidence event"
}
