{
  "accepted": false,
  "artifact_path": "",
  "artifact_sha256": "1d79e12338c271c127276a54e3168a5e57749ca8da6202696557c02f9337cc89",
  "claim_level": "SOFTWARE_SLICE",
  "collected_at_utc": "2026-08-06T20:16:47Z",
  "evidence_class": "software",
  "evidence_id": "ring-auth-gate1-run-2026-08-06T201647Z",
  "notes": "{\"sample\": {\"anti_replay_nonce\": \"nonce-gate1-01\", \"auth_method\": \"fixture\", \"authenticated\": true, \"collected_at_utc\": \"2026-08-06T20:16:47Z\", \"evidence_class\": \"software\", \"notes\": \"software fixture; not physical ring auth\", \"payload_digest_sha256\": \"46e7354540921f383a97d96c30835041a9b30c0016e5a4dc569499e0a3be9afb\", \"schema_version\": \"1.0.0\", \"session_id\": \"software-ring-session\", \"source\": \"fixture\"}, \"software_ok\": true}",
  "schema_version": "1.0.0",
  "tool_versions": {
    "gate1_orchestrator": "0.1.0",
    "platform": "macOS-26.5.2-arm64-arm-64bit",
    "python": "3.11.2"
  },
  "workstream": "ring-auth"
}
