{
  "schema_version": "1.0.0",
  "evidence_id": "fixture-software-1",
  "workstream": "boot",
  "evidence_class": "software",
  "artifact_sha256": "aaaaaaaaaaaaaaaaaaaaaaaaaaaaaaaaaaaaaaaaaaaaaaaaaaaaaaaaaaaaaaaa",
  "tool_versions": {
    "gate1_orchestrator": "0.1.0"
  },
  "collected_at_utc": "2026-08-07T00:00:00Z",
  "claim_level": "SOFTWARE_SLICE",
  "accepted": false,
  "notes": "deterministic software fixture"
}
