{
  "accepted": false,
  "artifact_path": "/Users/gunnchos/Downloads/gunnchos-7gc-research-product-spine/repos/gunnchAI3k",
  "artifact_sha256": "ae30b623a36061291f25f89c9297b841d53cd1fa2ecbf040ff1332d4a4bd163c",
  "claim_level": "SOFTWARE_SLICE",
  "collected_at_utc": "2026-08-06T20:16:45Z",
  "evidence_class": "software",
  "evidence_id": "ai-runtime-gate1-run-2026-08-06T201645Z",
  "notes": "{\"sample\": {\"collected_at_utc\": \"2026-08-06T20:16:45Z\", \"evidence_class\": \"software\", \"health\": \"ok\", \"mode\": \"local_only\", \"model_id\": null, \"network_egress\": \"denied\", \"notes\": \"local-only contract probe; not on-device physical runtime\", \"runtime_id\": \"gunnchai3k-local-software\", \"runtime_version\": \"software-probe\", \"schema_version\": \"1.0.0\"}, \"software_ok\": true}",
  "schema_version": "1.0.0",
  "tool_versions": {
    "gate1_orchestrator": "0.1.0",
    "platform": "macOS-26.5.2-arm64-arm-64bit",
    "python": "3.11.2"
  },
  "workstream": "ai-runtime"
}
