{
  "accepted": false,
  "artifact_path": "/Users/gunnchos/Downloads/gunnchos-7gc-research-product-spine/repos/gunnchos-device-os",
  "artifact_sha256": "5ffc1ae43c1c4d4a92302841fad5848bed2860b34adac057ee2dd061ba234bed",
  "claim_level": "SOFTWARE_SLICE",
  "collected_at_utc": "2026-08-06T20:16:46Z",
  "evidence_class": "software",
  "evidence_id": "dock-gate1-run-2026-08-06T201646Z",
  "notes": "{\"sample\": {\"collected_at_utc\": \"2026-08-06T20:16:46Z\", \"continuity_ok\": true, \"display_handoff\": false, \"dock_profile\": \"software_emulated\", \"evidence_class\": \"software\", \"notes\": \"emulated dock session; not physical dock\", \"power_negotiated\": false, \"schema_version\": \"1.0.0\", \"session_id\": \"software-dock-session\"}, \"software_ok\": true}",
  "schema_version": "1.0.0",
  "tool_versions": {
    "gate1_orchestrator": "0.1.0",
    "platform": "macOS-26.5.2-arm64-arm-64bit",
    "python": "3.11.2"
  },
  "workstream": "dock"
}
