{
  "accepted": false,
  "artifact_path": "/Users/gunnchos/Downloads/gunnchos-7gc-research-product-spine/repos/anime-aggressors",
  "artifact_sha256": "c186fdf67c54463ea81d9cc9f7960c44d50d9e1d721fcabe7e4a4159c2610ef3",
  "claim_level": "SOFTWARE_SLICE",
  "collected_at_utc": "2026-08-06T20:16:45Z",
  "evidence_class": "software",
  "evidence_id": "game-anime-aggressors-gate1-run-2026-08-06T201645Z",
  "notes": "{\"build_id\": \"gate1-software-discovery\", \"commit\": \"877b4ad3484e\", \"detail\": {\"evidence_class\": \"software\", \"markers\": [\"README.md\", \"game\", \"package.json\"], \"notes\": \"software discovery; not physical device core loop\"}, \"evidence_type\": \"runtime_smoke\", \"game\": \"anime-aggressors\", \"platform\": \"software_harness\", \"result\": \"pass\", \"session_id\": \"gate1-soft-anime-aggressors\", \"state_checksum\": \"b308389018c6f4e4\", \"step\": \"discover_repo_and_markers\", \"timestamp\": \"2026-08-06T20:16:45+00:00\"}",
  "schema_version": "1.0.0",
  "tool_versions": {
    "gate1_orchestrator": "0.1.0",
    "platform": "macOS-26.5.2-arm64-arm-64bit",
    "python": "3.11.2"
  },
  "workstream": "games"
}
