{
  "accepted": false,
  "artifact_path": "/Users/gunnchos/Downloads/gunnchos-7gc-research-product-spine/repos/beatlink-party",
  "artifact_sha256": "2eadc33eba420eb27bf983a7580c04e61cf8e7b095f0ca4675dd240d070e4eca",
  "claim_level": "SOFTWARE_SLICE",
  "collected_at_utc": "2026-08-06T20:16:45Z",
  "evidence_class": "software",
  "evidence_id": "game-beatlink-party-gate1-run-2026-08-06T201645Z",
  "notes": "{\"build_id\": \"gate1-software-discovery\", \"commit\": \"75c6dbf4af5b\", \"detail\": {\"evidence_class\": \"software\", \"markers\": [\"README.md\", \"package.json\", \"tests\"], \"notes\": \"software discovery; not physical device core loop\"}, \"evidence_type\": \"runtime_smoke\", \"game\": \"beatlink-party\", \"platform\": \"software_harness\", \"result\": \"pass\", \"session_id\": \"gate1-soft-beatlink-party\", \"state_checksum\": \"5006e5dfe707d26a\", \"step\": \"discover_repo_and_markers\", \"timestamp\": \"2026-08-06T20:16:45+00:00\"}",
  "schema_version": "1.0.0",
  "tool_versions": {
    "gate1_orchestrator": "0.1.0",
    "platform": "macOS-26.5.2-arm64-arm-64bit",
    "python": "3.11.2"
  },
  "workstream": "games"
}
